{
  "$schema": "./android-contract.schema.json",
  "pluginId": "omnix-mobile",
  "androidOnly": true,
  "kotlinPackage": "co.ke.omnix.app.mobile",
  "kotlinClass": "OmnixMobilePlugin",
  "commands": [
    "secure_storage_availability",
    "secure_storage_get",
    "secure_storage_set",
    "secure_storage_remove",
    "biometric_availability",
    "biometric_permission",
    "biometric_request_permission",
    "biometric_authenticate",
    "scanner_availability",
    "scanner_permission",
    "scanner_request_permission",
    "scanner_scan",
    "scanner_cancel",
    "share_availability",
    "share_permission",
    "share_request_permission",
    "share",
    "notification_availability",
    "notification_permission",
    "notification_request_permission",
    "notification_post",
    "notification_cancel",
    "mesh_availability",
    "mesh_status",
    "mesh_start",
    "mesh_stop",
    "lifecycle_current_state",
    "lifecycle_complete_back",
    "apk_update_availability",
    "apk_update_status",
    "apk_update_stage",
    "apk_update_install",
    "apk_update_cancel"
  ],
  "events": [
    "lifecycle",
    "back-requested",
    "apk-update-progress",
    "notification-opened"
  ],
  "runtimePermissions": [
    "android.permission.CAMERA",
    "android.permission.POST_NOTIFICATIONS"
  ],
  "installPermissions": [
    "android.permission.INTERNET",
    "android.permission.ACCESS_NETWORK_STATE",
    "android.permission.FOREGROUND_SERVICE",
    "android.permission.FOREGROUND_SERVICE_SPECIAL_USE",
    "android.permission.REQUEST_INSTALL_PACKAGES"
  ],
  "forbiddenPermissions": [
    "android.permission.ACCESS_FINE_LOCATION",
    "android.permission.ACCESS_COARSE_LOCATION",
    "android.permission.READ_CONTACTS",
    "android.permission.WRITE_CONTACTS",
    "android.permission.READ_SMS",
    "android.permission.SEND_SMS",
    "android.permission.READ_CALL_LOG",
    "android.permission.WRITE_CALL_LOG",
    "android.permission.MANAGE_EXTERNAL_STORAGE",
    "android.permission.READ_EXTERNAL_STORAGE",
    "android.permission.WRITE_EXTERNAL_STORAGE",
    "android.permission.BIND_ACCESSIBILITY_SERVICE",
    "android.permission.BIND_DEVICE_ADMIN",
    "android.permission.QUERY_ALL_PACKAGES"
  ],
  "updateHosts": ["omnix.co.ke", "media.omnix.co.ke"],
  "wireGuardCoordinate": "com.wireguard.android:tunnel:1.0.20260102",
  "generatedRoot": "src-tauri/gen/android",
  "sourceOverlayRoot": "src-tauri/mobile/android-overlay"
}
